{
  "schema_version": "1.0",
  "project_id": "PROJECT-001",
  "manifest_version": 1,
  "assets": [
    {"asset_id": "CHAR-001", "type": "character", "name": "李青", "aliases": [], "lock_status": "partial", "locked_fields": ["occupation", "uniform"], "evidence": [{"field": "occupation", "level": "confirmed", "source_ref": "SRC-001", "locator": "原始故事第1段"}, {"field": "uniform", "level": "confirmed", "source_ref": "SRC-001", "locator": "原始故事第1段"}], "visual_dna": {"anchors": ["县城客运站站务员", "制服外套", "湿透肩膀"]}},
    {"asset_id": "CHAR-002", "type": "character", "name": "陈伯", "aliases": [], "lock_status": "partial", "locked_fields": ["age-range", "umbrella-owner"], "evidence": [{"field": "age-range", "level": "confirmed", "source_ref": "SRC-001", "locator": "原始故事第2段"}, {"field": "umbrella-owner", "level": "confirmed", "source_ref": "SRC-001", "locator": "原始故事第3-4段"}], "visual_dna": {"anchors": ["七十多岁", "黄色旧伞", "喘息"]}},
    {"asset_id": "CHAR-003", "type": "character", "name": "张敏", "aliases": [], "lock_status": "partial", "locked_fields": ["occupation"], "evidence": [{"field": "occupation", "level": "confirmed", "source_ref": "SRC-001", "locator": "原始故事第2段"}], "visual_dna": {"anchors": ["调度员", "值班台"]}},
    {"asset_id": "CHAR-004", "type": "character", "name": "女儿", "aliases": [], "lock_status": "partial", "locked_fields": ["relationship", "performance-role"], "evidence": [{"field": "relationship", "level": "confirmed", "source_ref": "SRC-001", "locator": "原始故事第1、5段"}, {"field": "performance-role", "level": "confirmed", "source_ref": "SRC-001", "locator": "原始故事第1、5段"}], "visual_dna": {"anchors": ["李青的女儿", "礼堂舞台朗诵者"], "prohibited_drift": ["未确认年龄、服装和面部，不得据此生成锁定角色图"]}},
    {"asset_id": "CHAR-005", "type": "character", "name": "老周", "aliases": ["司机老周"], "lock_status": "partial", "locked_fields": ["occupation", "voice-function"], "evidence": [{"field": "occupation", "level": "confirmed", "source_ref": "SRC-001", "locator": "原始故事第2段"}, {"field": "voice-function", "level": "confirmed", "source_ref": "SRC-001", "locator": "原始故事第3-4段"}], "visual_dna": {"anchors": ["末班车司机", "电台声音"], "prohibited_drift": ["当前示例按画外电台处理，不生成固定外观"]}},
    {"asset_id": "PROP-001", "type": "prop", "name": "黄色旧伞", "aliases": ["旧伞"], "lock_status": "locked", "locked_fields": ["color", "wear", "owner", "state-chain"], "evidence": [{"field": "color", "level": "confirmed", "source_ref": "SRC-001", "locator": "原始故事第3-5段"}, {"field": "wear", "level": "confirmed", "source_ref": "SRC-001", "locator": "原始故事第3段"}, {"field": "owner", "level": "confirmed", "source_ref": "SRC-001", "locator": "原始故事第3-4段"}, {"field": "state-chain", "level": "confirmed", "source_ref": "SRC-001", "locator": "原始故事第3-5段"}], "visual_dna": {"anchors": ["黄色", "旧", "可折射礼堂灯光"]}},
    {"asset_id": "PROP-002", "type": "prop", "name": "蓝色保温杯", "aliases": [], "lock_status": "locked", "locked_fields": ["color", "owner", "interaction"], "evidence": [{"field": "color", "level": "confirmed", "source_ref": "SRC-001", "locator": "原始故事第3段"}, {"field": "owner", "level": "confirmed", "source_ref": "SRC-001", "locator": "原始故事第3段"}, {"field": "interaction", "level": "confirmed", "source_ref": "SRC-001", "locator": "原始故事第3段"}], "visual_dna": {"anchors": ["蓝色", "李青所有", "场2递给陈伯"]}},
    {"asset_id": "PROP-003", "type": "prop", "name": "灰布包", "aliases": [], "lock_status": "locked", "locked_fields": ["material", "contents", "recovery"], "evidence": [{"field": "material", "level": "confirmed", "source_ref": "SRC-001", "locator": "原始故事第2段"}, {"field": "contents", "level": "confirmed", "source_ref": "SRC-001", "locator": "原始故事第2段"}, {"field": "recovery", "level": "confirmed", "source_ref": "SRC-001", "locator": "原始故事第4段"}], "visual_dna": {"anchors": ["灰色布包", "降压药", "住院押金单"]}},
    {"asset_id": "PROP-004", "type": "prop", "name": "值班电台", "aliases": ["电台"], "lock_status": "partial", "locked_fields": ["function", "interaction-chain"], "evidence": [{"field": "function", "level": "confirmed", "source_ref": "SRC-001", "locator": "原始故事第3-4段"}, {"field": "interaction-chain", "level": "confirmed", "source_ref": "SRC-001", "locator": "原始故事第3-4段"}], "visual_dna": {"anchors": ["客运站值班通信设备", "李青与老周通联"]}},
    {"asset_id": "PROP-005", "type": "prop", "name": "登记表", "aliases": [], "lock_status": "partial", "locked_fields": ["handoff"], "evidence": [{"field": "handoff", "level": "confirmed", "source_ref": "SRC-001", "locator": "原始故事第4段"}], "visual_dna": {"anchors": ["场4由李青交给张敏"], "prohibited_drift": ["版式和字段未确认，文字画面应后期制作或保持不可读"]}},
    {"asset_id": "PROP-006", "type": "prop", "name": "墙钟", "aliases": ["墙上的钟"], "lock_status": "partial", "locked_fields": ["display-time"], "evidence": [{"field": "display-time", "level": "confirmed", "source_ref": "ART-005", "locator": "场1：23:40"}], "visual_dna": {"anchors": ["客运站墙钟", "显示23:40"]}},
    {"asset_id": "PROP-007", "type": "prop", "name": "末班车", "aliases": ["去南桥的公交"], "lock_status": "partial", "locked_fields": ["route-function", "safe-stop-chain"], "evidence": [{"field": "route-function", "level": "confirmed", "source_ref": "SRC-001", "locator": "原始故事第1-2段"}, {"field": "safe-stop-chain", "level": "confirmed", "source_ref": "SRC-001", "locator": "原始故事第3-4段"}], "visual_dna": {"anchors": ["县城客运站末班公交", "驶出出口后在安全区靠边", "最后一排找到灰布包"], "prohibited_drift": ["车型、车牌和涂装未确认，不生成锁定车辆资产"]}},
    {"asset_id": "SCENE-001", "type": "scene", "name": "县城客运站", "aliases": ["候车厅", "站台", "出口", "值班台"], "lock_status": "partial", "locked_fields": ["functional-zones", "exit-light"], "evidence": [{"field": "functional-zones", "level": "confirmed", "source_ref": "SRC-001", "locator": "原始故事第1-4段"}, {"field": "exit-light", "level": "confirmed", "source_ref": "SRC-001", "locator": "原始故事第3段"}, {"field": "layout", "level": "inferred", "source_ref": "SRC-001", "locator": "原始故事第1-4段"}], "visual_dna": {"anchors": ["深夜县城客运站", "候车厅", "站台", "出口安全区", "值班台", "玻璃门", "出口灯"]}},
    {"asset_id": "SCENE-002", "type": "scene", "name": "学校礼堂", "aliases": ["礼堂门外", "门内舞台"], "lock_status": "partial", "locked_fields": ["functional-zones", "glass-door", "exit-light", "visible-stage"], "evidence": [{"field": "functional-zones", "level": "confirmed", "source_ref": "SRC-001", "locator": "原始故事第5段"}, {"field": "glass-door", "level": "confirmed", "source_ref": "SRC-001", "locator": "原始故事第5段"}, {"field": "exit-light", "level": "confirmed", "source_ref": "SRC-001", "locator": "原始故事第5段"}, {"field": "visible-stage", "level": "confirmed", "source_ref": "SRC-001", "locator": "原始故事第5段"}], "visual_dna": {"anchors": ["礼堂外侧", "玻璃门", "安全出口灯", "门内观众席与舞台"]}}
  ]
}
